Isi Berita,Kategori
timesindonesia jakarta tauco salah bumbu tradisional indonesia kenal cita khas kuat unik bumbu hasil fermentasi kedelai campur garam bahanbahan cipta gurih kaya sentuh manis asam tauco masakan indonesia hidanganhidangan butuh dalam sayur tauco ayam tauco tumis lainnyaadvertisement usul sejarah tauco tauco milik sejarah hubung budaya kuliner tionghoa indonesia bumbu bawa imigran tionghoa tetap wilayah nusantara daerah pesisir sumatera utara jawa barat jawa iring tauco integral masakan lokal adopsi hidang tradisional daerah indonesia tauco kenal sebut beda sumatera utara tauco taoco jawa barat bumbu kenal nama variasi bahan metode buat wilayah cianjur jawa barat tauco produksi metode fermentasi khas hasil kompleks manis banding tauco daerah proses buat tauco buat tauco libat proses fermentasi minggu kedelai masak campur ragi garam fermentasi wadah tutup proses fermentasi kedelai alami ubah kimia hasil aroma khas tauco produsen tauco tradisional metode fermentasi alami bahan awet tambah jadi bumbu autentik kaya tauco serbaguna jenis masakan jawa barat tauco sayur lodeh tumis sayur sumatera utara tauco bahan utama hidang ayam tauco ikan tauco milik cita kuat gugah selera tauco bahan dasar sambal tauco pedas gurih unik manfaat nilai gizi tauco bumbu masak tauco milik manfaat sehat proses fermentasi kedelai buat tauco hasil probiotik cerna kandung protein vitamin b tauco jadi tambah nutrisi manfaat tubuh guna tauco perhati kandung garam tauco bumbu kaya masakan milik nilai sejarah budaya dalam indonesia ada lintas generasi betapa tauco kuliner nusantara cita khas sulit temu bumbu tauco pilih favorit orang tambah dalam masakan ikut berita baru times indonesia google news klik link lupa follow,1
timesindonesia jakarta rabu 492024 hiruk pikuk gedung parlemen senayan jakarta menteri hukum ham menkumham supratman andi agtas lang mantap terik matahari siang wartawan tunggu nyata dari kait ubah baru pkb supratman nada tenang konfirmasi menandatangani surat putus sk urus partai bangkit bangsa pkb advertisement salah tanda tangan salah ya supratman senyum tipis isyarat sk tanda babak pkb muhaimin iskandar akrab sapa cak imin percaya pimpin partai periode 2024 2029 damping hasanudin wahid cak hasan sekretaris jenderal sekjen muktamar vi pkb helat bal agustus saksi putus sana struktur pkb bentuk hadap tantang politik kian kompleks urus namanama asing warna dinamika partai tokoh andal cak imin bawa partai maju tegang suasana politik kabar angin segar kaderkader pkb tunggu arah partai bambang susanto sang bendahara benar sk ditandatangani menteri hukum ham tonggak partai sk kemenkumham lengkap posisi ketua hari deputi sekretaris eksekutif bambang wartawan jakarta jabatanjabatan curi perhati tambah wakil ketua capai enam orang sembarang putus cermin strategi pkb hadap kompetisi politik ketat susun urus umum kalah tarik kh maruf amin ketua dewan syuro jajar wakil ketua tujuh orang posisi ketua pegang cak imin enam wakil ketua damping jalan roda organisasi jazilul fawaid ida fauziyah hanif dhakiri cucun ahmad syamsurijal faizol reza m rano alfath masingmasing percaya duduk posisi strategis ubah susun urus sk simbol sinambung baru tubuh pkb pegang jabat partai hadap kontestasi politik 2024 urus ramping organisir harap tingkat efektivitas kerja pkb panggung politik nasional susun urus pkb tetap ketua dewan syuro kh maruf amin ketua muhaimin iskandar wakil ketua jazilul fawaid ida fauziyah hanif dhakiri cucun ahmad syamsurijal faizol reza m rano alfath ketua bidang didik pesantren syaiful huda sekretaris jenderal hasanudin wahid wakil sekjen 4 orang bendahara bambang susanto wakil bendahara 5 orang narasi politik indonesia pkb partai basis massa kuat kalang nahdliyin kerap tentu pilih muhaimin iskandar malang lintang dunia politik indonesia sosok alam cak imin yakin bawa pkb posisi strategis legislatif eksekutif iring jalan harap pikul pundak urus pkb partai rakyat kontribusi nyata pimpin cak imin harap satu elemen kuat fondasi politik pkb hadap dinamika ikut berita baru times indonesia google news klik link lupa follow,0
timesindonesia malang minggu 192024 komunitas oom ir jalanjalan indonesia colonial heritage gelar acara tema tweede stadsplanning kota malang acara kali jam pagi istimewa libat kolaborasi ikat arsitek indonesia iai wilayah malangadvertisement acara serta ajak nikmat indah bangun heritage malang sempat gali sisi artistik dokumenter jalan acara sesi gambar gedung balai kota malang serta ajak jalanjalan keliling susur bangun sejarah malang gedung balai kota malang alunalun tugu bintal tni ad sma 3 kota malang serta rasa atmosfer kental bangunanbangunan era kolonial diri kokoh gedung bekas sekolah montessori school jalan suropati malang montessori school suropati gedung arsitektur lawas khas kolonial belanda letak jalan suropati lokasi strategis jalan utama alunalun tugu kota malang balai kota malang arah utara sesi acara lomba gambar gedung balai kota malang foto adam julianotimes indonesia gedung hadap gedung kantor bintal tni ad kodam brawijaya gedung bangun 1926 tembok fasad gedung tulis anno 1926 gedung selesai bangun 1929 diri anakanak jabat kolonial belanda hidup malang nama gedung montessori school sekolah anakanak tingkat taman kanakkanak kabar gedung bangun prakarsa organisasi rahasia freemason malang gedung sayang arsitek plakat fisik gedung era merdeka gedung berubahubah fungsi 2015 fungsi toko factory outlet cargo cafe letak paviliun belah gedung utama kaca patri khas jaman kolonial belanda asa sisi gedung nampak hilang fungsi factory outlet kaca patri indah malam kena sinar lampu gedung interior lantai ubin bangun asli sayang gedung bengkalai pagar seng bangun gedung balai kota malang sejarah gedung balai kota malang bangun 19271929 malang kota mandiri lepas pasoeroean rancang arsitek belanda citroen gedung milik desain balai kota surabaya letak selatan jp coen plein kenal alunalun bundar gedung milik arsitektur unik langitlangit fungsi atur audio sirkulasi udara balkon atap nikmat sinar matahari tropis 1947 gedung bakar rakyat malang cegah duduk belanda bangun 1950an ubah desain asli antusiasme serta catur yohannes salah serta acara aku suka tarik gedung balai kota malang gedung bekas tinggal belanda gedung dialihfungsikan gedung balai kota malang jelas sejarah bangun heritage bintal tni ad kota malang om irawan foto adam julianotimes indonesia gedung desain bangsa belanda arsitektur ala belanda arsitektur jaga rawat pemerinta kota malang awat tegel pasang diri utuh kolonial belanda injak kaki tegel balai kota malang imbuh catur irawan paulus salah anggota komunitas ich komunitas bentuk cinta sejarah bangun heritage kolonial ada acara bulan komunitas nama indonesia colonial heritage ich 2023 kumpul cinta sejarah nama organisir irawan tuju utama acara kenal rawat cinta sejarah kota malang juluk kota belanda banyak bangun kolonial awat antusiasme serta tingkat serta capai 110 orang ratarata serta irawan harap acara laksana orang tarik partisipasi harap cinta kota malang sejarah tumbuh cerita kota tahan terus generasi tutup ikut berita baru times indonesia google news klik link lupa follow,1
timesindonesia jakarta pimpin presiden ri prabowo subianto indonesia potensi bangkit macan asia segani panggung internasional fokus mandiri pangan energi kuat ekonomi tega hukum prabowo harap bawa indonesia era kuat regional tangguh berpengaruhadvertisement analisis ketua poros pemuda indonesia ppi muhlis ali dapat kait prospek perintah prabowo rabu 492024 muhlis indonesia ambang transformasi lantik presiden republik indonesia 20 oktober 2024 prabowo subianto prediksi langsung tancap gas wujud janjijanji kampanye nanti rakyat indonesia 20 oktober prabowo media darling simbol harap rakyat nama harum popularitas alami lonjak perintah kerap initial popularity surge muhlis ali bangun demokrasi sehat muhlis nilai prabowo milik visi kuat pimpin bangsa bagai sempat prabowo demokrasi sehat kelola kuasa tanggung apresiasi ungkap prabowo sebut haus kuasa ganggu rugi bangsa prabowo acu pandang demokrasi modern kuasa tangan rakyat jalan integritas muhlis salah agenda perintah prabowo profesionalisme fungsi intelijen acara tutup kongres pan prabowo tekan intelijen penting bangsa alat politik pakai alatalat caracara duludulu adu domba ngintelngintelin orang intel tuh rakyat bangsa ngintelin lawan politik nggak enak prabowo muhlis ali sebut nyata angin segar demokrasi indonesia alat negara intimidasi lawan politik demokrasi ancam mantan ketua pb hmi tekan bebas ekspres bebas pers pilar demokrasi sehat era pimpin prabowo kriminalisasi oposisi pers beda dapat perintah suara kritis ruang bungkam beda pandang turut jaga bebas kunci bangun perintah buka transparan akuntabel dorong partisipasi aktif elemen masyarakat muhlis apresiasi upaya prabowo galang satu rekonsiliasi turut kuat ajak imbang fungsi oposisi demokrasi oposisi jaga check and balance oposisi objektif beda dasar mandiri pangan energi konteks ekonomi prabowo tempat swasembada pangan energi prioritas utama kurang gantung impor nyata prabowo sebut indonesia takut negara mana hasil daulat bidang pangan energi muhlis bukti komitmen prabowo kuat daulat ekonomi nasional salah langkah konkret ambil perintah selesai uji coba komersil solar bas sawit kadar 40 persen b40 langkah upaya nyata kurang gantung bahan bakar fosil kembang energi baru muhlis sorot berani prabowo hadap presiden prancis emmanuel macron usaha uni eropa kait embargo minyak sawit indonesia terima kasih larang kelapa sawit masuk eropa kelapa sawit penting rakyat swasembada energi prabowo muhlis sikap patut apresiasi teguh prabowo tahan daulat indonesia hadap kuat internasional transparansi supremasi hukum muhlis ali tekan transparansi akuntabilitas perintah rakyat yakin perintah prabowo benarbenar penting kelompok prabowo jaga integritas perintah bersih bebas korupsi muhlis supremasi hukum sorot utama muhlis tega hukum adil sulit perintah bangun citra bersih wibawa prabowo hukum tegak pandang bulu kunci jaga percaya rakyat muhlis ali menggarisbawahi komitmen prabowo berantas korupsi momok serius indonesia nyata prabowo sisih anggar khusus berantas korupsi kejar koruptor lari antartika genderang perang korupsi dukung indonesia macan asia muhlis ali percaya alam lengkap prabowo didik militer didik modern barat peran oposisi pimpin organisasi massa bekal kuat prabowo bawa indonesia macan asia segani dunia wujud visi muhlis kabinet solid orientasi tingkat tumbuh ekonomi cipta lapang kerja revitalisasi industri kembang sumber daya manusia unggul dukung usaha mikro tengah umkm kuat akses mudah biaya teknologi pasar kelola bijak fiskal efektif kurang pajak beri insentif sektor bijak moneter jaga stabilitas inflasi suku bunga rendah faktor tentu capai tumbuh ekonomi lanjut dinamika global prabowo demokrasi indonesia milik karakteristik khas demokrasi pancasila depan musyawarah mufakat waris nenek moyang prabowo demokrasi ala barat demokrasi indonesia ciri khas demokrasi pancasila muhlis nilai pandang relevan standar ganda terap negaranegara barat sepenuh cocok acu indonesia periode tentu indonesia muhlis ali poros pemuda indonesia awal dukung konstruktif perintah prabowo momen lompat maju ppi awal dukung konstruktif perintah prabowo muhlis ali ikut berita baru times indonesia google news klik link lupa follow,0
timesindonesia jakarta pimpin presiden ri prabowo subianto indonesia potensi bangkit macan asia segani panggung internasional fokus mandiri pangan energi kuat ekonomi tega hukum prabowo harap bawa indonesia era kuat regional tangguh berpengaruhadvertisement analisis ketua poros pemuda indonesia ppi muhlis ali dapat kait prospek perintah prabowo rabu 492024 muhlis indonesia ambang transformasi lantik presiden republik indonesia 20 oktober 2024 prabowo subianto prediksi langsung tancap gas wujud janjijanji kampanye nanti rakyat indonesia 20 oktober prabowo media darling simbol harap rakyat nama harum popularitas alami lonjak perintah kerap initial popularity surge muhlis ali bangun demokrasi sehat muhlis nilai prabowo milik visi kuat pimpin bangsa bagai sempat prabowo demokrasi sehat kelola kuasa tanggung apresiasi ungkap prabowo sebut haus kuasa ganggu rugi bangsa prabowo acu pandang demokrasi modern kuasa tangan rakyat jalan integritas muhlis salah agenda perintah prabowo profesionalisme fungsi intelijen acara tutup kongres pan prabowo tekan intelijen penting bangsa alat politik pakai alatalat caracara duludulu adu domba ngintelngintelin orang intel tuh rakyat bangsa ngintelin lawan politik nggak enak prabowo muhlis ali sebut nyata angin segar demokrasi indonesia alat negara intimidasi lawan politik demokrasi ancam mantan ketua pb hmi tekan bebas ekspres bebas pers pilar demokrasi sehat era pimpin prabowo kriminalisasi oposisi pers beda dapat perintah suara kritis ruang bungkam beda pandang turut jaga bebas kunci bangun perintah buka transparan akuntabel dorong partisipasi aktif elemen masyarakat muhlis apresiasi upaya prabowo galang satu rekonsiliasi turut kuat ajak imbang fungsi oposisi demokrasi oposisi jaga check and balance oposisi objektif beda dasar mandiri pangan energi konteks ekonomi prabowo tempat swasembada pangan energi prioritas utama kurang gantung impor nyata prabowo sebut indonesia takut negara mana hasil daulat bidang pangan energi muhlis bukti komitmen prabowo kuat daulat ekonomi nasional salah langkah konkret ambil perintah selesai uji coba komersil solar bas sawit kadar 40 persen b40 langkah upaya nyata kurang gantung bahan bakar fosil kembang energi baru muhlis sorot berani prabowo hadap presiden prancis emmanuel macron usaha uni eropa kait embargo minyak sawit indonesia terima kasih larang kelapa sawit masuk eropa kelapa sawit penting rakyat swasembada energi prabowo muhlis sikap patut apresiasi teguh prabowo tahan daulat indonesia hadap kuat internasional transparansi supremasi hukum muhlis ali tekan transparansi akuntabilitas perintah rakyat yakin perintah prabowo benarbenar penting kelompok prabowo jaga integritas perintah bersih bebas korupsi muhlis supremasi hukum sorot utama muhlis tega hukum adil sulit perintah bangun citra bersih wibawa prabowo hukum tegak pandang bulu kunci jaga percaya rakyat muhlis ali menggarisbawahi komitmen prabowo berantas korupsi momok serius indonesia nyata prabowo sisih anggar khusus berantas korupsi kejar koruptor lari antartika genderang perang korupsi dukung indonesia macan asia muhlis ali percaya alam lengkap prabowo didik militer didik modern barat peran oposisi pimpin organisasi massa bekal kuat prabowo bawa indonesia macan asia segani dunia wujud visi muhlis kabinet solid orientasi tingkat tumbuh ekonomi cipta lapang kerja revitalisasi industri kembang sumber daya manusia unggul dukung usaha mikro tengah umkm kuat akses mudah biaya teknologi pasar kelola bijak fiskal efektif kurang pajak beri insentif sektor bijak moneter jaga stabilitas inflasi suku bunga rendah faktor tentu capai tumbuh ekonomi lanjut dinamika global prabowo demokrasi indonesia milik karakteristik khas demokrasi pancasila depan musyawarah mufakat waris nenek moyang prabowo demokrasi ala barat demokrasi indonesia ciri khas demokrasi pancasila muhlis nilai pandang relevan standar ganda terap negaranegara barat sepenuh cocok acu indonesia periode tentu indonesia muhlis ali poros pemuda indonesia awal dukung konstruktif perintah prabowo momen lompat maju ppi awal dukung konstruktif perintah prabowo muhlis ali ikut berita baru times indonesia google news klik link lupa follow,0
timesindonesia surabaya pasang khofifah indar parawansaemil dardak nilai amat suara pilih gubernur jawa timur pilgub jatim 2024 direktur eksekutif kaji politik nasional kpn adib miftahul rabu 492024 adib faktor peran modal kuat khofifahadvertisement pilkada masyarakat dominan figur latar partai politik figur popularitas elektabilitas akseptabilitas terima figur masyarakat calon buat track record kerja khofifah unggul lantar alam tri rismaharini luluk nur hamidah khofifah matang organisasi anggota dpr menteri gubernur track record milik saing dekat risma walikota menteri adib dosen fisip unis khusus khofifah adib khofifah konversi figur dominan mesin partai dukung peluang menang head to head risma dekat risma figur populer calon wakil gubernur mensupport suara basis elektoralnya beda khofifah tunjang emil dardak sumbang suara signifikan kalang muda gen z risma dukung wilayah arek jabat walikota surabaya sambung adib anggap suara nu pecah signifikan pilkada figur dominan ketimbang partai pdip pkb suara pileg beda pilkada pileg caleg juang suara otomatis partai suara pilkada pileg prediksi suara pilpres kemarin linier suara pilkada dukung koalisi kim representasi khofifah prabowogibran khofifah dukung muslimat andal klaim luluk suara utuh pkb ragu identitas politik kenuan masingmasing kandidat kuat kalang nahdliyin pilih rasional tiga kandidat identitas politik kenuan masingmasing kuat kalang nahdliyin pilih rasional khofifah untung tahana unggul politik teknokratik hadir visimisi program nyata realistis masyarakat jatim khofifah bukti imbuh adib ancam khofifah risma ancam serius risma populer wilayah arek dukung suara wakil emil dardak ikut berita baru times indonesia google news klik link lupa follow,0
timesindonesia bantul rois syuriah pcnu bantul visi misi pasang calon bupati wakil bupati untoro hariadi wahyudi anggoro had jalan pcnu bantul ketua rois syuriah pcnu bantul damanhuri terima silaturahmi pasang calon bupati wakil bupati untoro hariadi wahyudi anggoro had kantor pcnu bantul barubaru iniadvertisement komprehensif gambar visi misi sinergi pcnu sentuh dimensi silaturahmi mohon doa restu damanhuri visi misi paslon cocok pcnu bantul calon wakil bupati wahyudi anggoro had persis masalah internal nu wahyudi kader militan nu rinci mas wahyudi visi misi program sinergi program nu beliau kader nu hadap nu kendati kontestasi pilkada sesuai tentu organisasi pcnu bantul paslon mana kader nu berkontestasi sebut tiga paslon milik program bantul depan aku wahyudi anggoro had kader milik prestasi bangga nahdliyin calon bupati bantul untoro hariadi komitmen jalin sinergitas nahdlatul ulama pasal masalah kompleks atas perintah paslon usung jargon bantul benah bantul gumregah percaya sinergitas organisasi masyarakat intensif bangun organisasi kembang bumi projotamansari ikut berita baru times indonesia google news klik link lupa follow,0
timesindonesia mojokerto ribu kader pkb kabupaten mojokerto konsolidasi menang jelang helat pilih milu serentak gubernur wakil gubernur bupati wakil bupati 2024 ketua dpc pkb kabupaten mojokerto ayni zuroh konsolidasi langkah baris menang pasang calon bupati wakil bupati ikfina fahmawati sadullah syarofiadvertisement konsolidasi serentak bagi 18 camat serentak target menang kandidat usung idola akronim ikfina fahmawati sadullah syarofi red ayni masingmasing ranting pkb undang 90 130 orang kader harap kuat dukung aspirasi masyarakat pilih sosok pimpin daerah sejahtera masyarakat harap konsolidasi bawa menang pasang idola berkontestasi 27 november 2024 pungkas samping pkb kabupaten mojokerto konsolidasi menang pasang gubernur wakil gubernur luluk nur hamidah lukmanul hakim ikut berita baru times indonesia google news klik link lupa follow,0
timesindonesia jakarta partai bangkit bangsa pkb posisi cak imin pimpin puncak menteri hukum ham kemenkumham menandatangani surat putus sk kait struktur urus dpp pkb periode 20242029 sesuai wajah urus inti pkb dominasi tokohtokoh bukti pengaruh partai menkumham supratman andi agtas sk tanda tangan muhaimin iskandar alias cak imin jabat ketua pkb bukti pkb andal figur bawa partai posisi strategis kancah politik nasionaladvertisement hasil muktamar vi pkb gelar bal 2425 agustus 2024 dasar bentuk struktur urus susun posisiposisi inti ketua dewan syuro jabat kh maruf amin sekretaris jenderal hasanudin wahid tahan formasi kenal publik urus inti ubah pkb tambah posisi wakil ketua tambah enam orang namanama jazilul fawaid ida fauziyah hanif dhakiri muncul sinambung pimpin pkb pimpin stabil hadap milu 2024 tambah posisi wakil ketua anggap langkah strategis pkb hadap tantang politik milu 2024 jaga stabilitas internal partai langkah nilai strategi luas basis dukung akomodasi penting partai bambang susanto bendahara pkb sk ditandatangani kemenkumham posisi ketua hari deputi sekretaris eksekutif proses tetap struktur urus tetap posisi umum bambang kuat struktur langkah pkb saing politik ketat tahan urus inti pkb soliditas hadap tantang politik sinambung bijak pimpin cak imin struktur urus pkb periode 20242029 ketua dewan syuro kh maruf amin ketua a muhaimin iskandar wakil ketua jazilul fawaid ida fauziyah hanif dhakiri cucun ahmad syamsurijal faizol reza m rano alfath sekretaris jenderal hasanudin wahid wakil sekretaris jenderal 4 orang bendahara bambang susanto wakil bendahara 5 orang posisi pkb kuat dewan syuro tujuh wakil ketua sekretaris wakil sekretaris 15 anggota bantu jalan agendaagenda partai dewan tanfidz pimpin cak imin dukung 21 ketua bidang 21 sekretaris bidang peran sektor partai tantang pimpin struktur andal wajahwajah pkb isyarat sinambung stabilitas kunci partai hadap tantang politik wajah urus inti ubah cermin percaya kader simpatisan pimpin cak imin tim pkb harap solid hadap milu 2024 kuat penuh langkah ambil pkb uji dinamika politik nasional kian kompetitif struktur pimpin uji tambah segar posisi strategis harap kukuh pkb salah partai politik pengaruh indonesia ikut berita baru times indonesia google news klik link lupa follow,0
timesindonesia lombok timur bupati lombok timur periode sukiman azmy mantap dukung pasang muhammad iqbal indah dhamayanti putri iqbaldinda pilkada ntb 2024 dukung urung maju pilgub ikhtiar menang pasang iqbaldinda sukiman temu khusus iqbal ponpes buak ate kembang mate camat sakra lombok timur rabu 492024advertisement sempat sukiman utara kagum iqbal sungguh niat juang bangun ntb dasar rawan hadir temu percaya mantan dubes turki iqbal bangun ntb program susun rapi lupa mantan bupati lombok timur periode titip harap iqbal perhati khusus dunia didik pondok pesantren anak yatim piatu ilah perhati pondok pesantren anak yatim jamin harap sempat muhammad iqbal terimakasih dukung sukiman azmy sukiman azmy anggap sikap politik positif tonton politis senior sanjung sikap politik positif ayah sukiman red iqbal acara limut senyum bahagia iqbal cita alas pulang kampung henti dubes turki muncul sempat pulang kampung hajat citacita pendam bangun kampung halaman ntb hajat 28 berkarir kait bangun daerah iqbal nilai tata kelola salah provinsi ntb syarat butuh ntb daerah maju sdm sda butuh tata kelola terusterusan jebak 10 provinsi miskin indonesia moga niat diijabah allah ubah tata kelola ntb harap gabung tim sukiman azmy lapis tebal kuat terimakasih ayah sukiman tim iqbal sambut ikut berita baru times indonesia google news klik link lupa follow,0
timesindonesia jakarta tauco salah bumbu tradisional indonesia kenal cita khas kuat unik bumbu hasil fermentasi kedelai campur garam bahanbahan cipta gurih kaya sentuh manis asam tauco masakan indonesia hidanganhidangan butuh dalam sayur tauco ayam tauco tumis lainnyaadvertisement usul sejarah tauco tauco milik sejarah hubung budaya kuliner tionghoa indonesia bumbu bawa imigran tionghoa tetap wilayah nusantara daerah pesisir sumatera utara jawa barat jawa iring tauco integral masakan lokal adopsi hidang tradisional daerah indonesia tauco kenal sebut beda sumatera utara tauco taoco jawa barat bumbu kenal nama variasi bahan metode buat wilayah cianjur jawa barat tauco produksi metode fermentasi khas hasil kompleks manis banding tauco daerah proses buat tauco buat tauco libat proses fermentasi minggu kedelai masak campur ragi garam fermentasi wadah tutup proses fermentasi kedelai alami ubah kimia hasil aroma khas tauco produsen tauco tradisional metode fermentasi alami bahan awet tambah jadi bumbu autentik kaya tauco serbaguna jenis masakan jawa barat tauco sayur lodeh tumis sayur sumatera utara tauco bahan utama hidang ayam tauco ikan tauco milik cita kuat gugah selera tauco bahan dasar sambal tauco pedas gurih unik manfaat nilai gizi tauco bumbu masak tauco milik manfaat sehat proses fermentasi kedelai buat tauco hasil probiotik cerna kandung protein vitamin b tauco jadi tambah nutrisi manfaat tubuh guna tauco perhati kandung garam tauco bumbu kaya masakan milik nilai sejarah budaya dalam indonesia ada lintas generasi betapa tauco kuliner nusantara cita khas sulit temu bumbu tauco pilih favorit orang tambah dalam masakan ikut berita baru times indonesia google news klik link lupa follow,1
