Isi Berita,Kategori
timesindonesia jakarta pepaya tanam asli indonesia asal daerah tropis amerika selatan meksiko negaranegara tanam kali temu duduk asli amerika dibudidayakan ribu pepaya indonesia populer jurnal judul the role of the papaya in colonial trade and botany jalan pepaya asia abad ke16 jalur dagang eksplorasi bangsa eropa jelajah spanyol portugal jajah benua amerika bawa tanam pepaya wilayah koloni asia upaya kaya sumber daya pangan perdaganganadvertisement pepaya kali bawa filipina jelajah spanyol 1550an tanam sebar wilayah asia tenggara jalur dagang interaksi antarbangsa pepaya cepat terima dibudidayakan negara mudah tumbuh iklim tropis manfaat buah suka orang masuk pepaya indonesia pepaya masuk indonesia abad ke16 abad ke17 jalur dagang filipina malu daerah pesisir nusantara dagang jelajah eropa belanda portugis milik pengaruh wilayah indonesia main peran introduksi tanam pepaya masuk indonesia pepaya cepat adaptasi kondisi iklim tanah lokal dukung tumbuh tanam dibudidayakan duduk lokal daerah konsumsi pribadi jual pasarpasar lokal sebar pepaya nusantara sebar pepaya indonesia alami upaya budidaya masyarakat faktor dukung sebar cepat pepaya nusantara 1 kondisi iklim dukung iklim tropis indonesia curah hujan sinar matahari ideal tumbuh pepaya tanam tumbuh jenis tanah kondisi lingkung jadi mudah dibudidayakan wilayah indonesia 2 tumbuh cepat produkti pepaya kenal tanam cepat buah 612 tanam buat sumber pangan efisien ekonomis masyarakat 3 manfaat sehat nutrisi sadar manfaat sehat kandung nutrisi buah pepaya minta buah tingkat dorong orang tanam membudidayakannya 4 guna agam buah tanam pepaya daun bunga masakan tradisional indonesia tambah nilai ekonomis kultural tanam masyarakat 5 dukung perintah institusi tani dekade perintah indonesia institusi tani teliti kembang varietas pepaya unggul latih tani tingkat produksi kualitas pepaya lokal jalan pepaya tanah asal amerika salah buah cinta indonesia cermin dinamika tukar budaya agrikultur berabadabad adaptabilitas manfaat sehat peran ekonomi jadi pepaya integral hidup seharihari masyarakat indonesia kembang teknik budidaya minta pasar pepaya prediksi komoditas sektor tani indonesia ikut berita baru times indonesia google news klik link lupa follow,1
timesindonesia jakarta pepaya tanam asli indonesia asal daerah tropis amerika selatan meksiko negaranegara tanam kali temu duduk asli amerika dibudidayakan ribu pepaya indonesia populer jurnal judul the role of the papaya in colonial trade and botany jalan pepaya asia abad ke16 jalur dagang eksplorasi bangsa eropa jelajah spanyol portugal jajah benua amerika bawa tanam pepaya wilayah koloni asia upaya kaya sumber daya pangan perdaganganadvertisement pepaya kali bawa filipina jelajah spanyol 1550an tanam sebar wilayah asia tenggara jalur dagang interaksi antarbangsa pepaya cepat terima dibudidayakan negara mudah tumbuh iklim tropis manfaat buah suka orang masuk pepaya indonesia pepaya masuk indonesia abad ke16 abad ke17 jalur dagang filipina malu daerah pesisir nusantara dagang jelajah eropa belanda portugis milik pengaruh wilayah indonesia main peran introduksi tanam pepaya masuk indonesia pepaya cepat adaptasi kondisi iklim tanah lokal dukung tumbuh tanam dibudidayakan duduk lokal daerah konsumsi pribadi jual pasarpasar lokal sebar pepaya nusantara sebar pepaya indonesia alami upaya budidaya masyarakat faktor dukung sebar cepat pepaya nusantara 1 kondisi iklim dukung iklim tropis indonesia curah hujan sinar matahari ideal tumbuh pepaya tanam tumbuh jenis tanah kondisi lingkung jadi mudah dibudidayakan wilayah indonesia 2 tumbuh cepat produkti pepaya kenal tanam cepat buah 612 tanam buat sumber pangan efisien ekonomis masyarakat 3 manfaat sehat nutrisi sadar manfaat sehat kandung nutrisi buah pepaya minta buah tingkat dorong orang tanam membudidayakannya 4 guna agam buah tanam pepaya daun bunga masakan tradisional indonesia tambah nilai ekonomis kultural tanam masyarakat 5 dukung perintah institusi tani dekade perintah indonesia institusi tani teliti kembang varietas pepaya unggul latih tani tingkat produksi kualitas pepaya lokal jalan pepaya tanah asal amerika salah buah cinta indonesia cermin dinamika tukar budaya agrikultur berabadabad adaptabilitas manfaat sehat peran ekonomi jadi pepaya integral hidup seharihari masyarakat indonesia kembang teknik budidaya minta pasar pepaya prediksi komoditas sektor tani indonesia ikut berita baru times indonesia google news klik link lupa follow,1
timesindonesia jakarta rabu 492024 hiruk pikuk gedung parlemen senayan jakarta menteri hukum ham menkumham supratman andi agtas lang mantap terik matahari siang wartawan tunggu nyata dari kait ubah baru pkb supratman nada tenang konfirmasi menandatangani surat putus sk urus partai bangkit bangsa pkb advertisement salah tanda tangan salah ya supratman senyum tipis isyarat sk tanda babak pkb muhaimin iskandar akrab sapa cak imin percaya pimpin partai periode 2024 2029 damping hasanudin wahid cak hasan sekretaris jenderal sekjen muktamar vi pkb helat bal agustus saksi putus sana struktur pkb bentuk hadap tantang politik kian kompleks urus namanama asing warna dinamika partai tokoh andal cak imin bawa partai maju tegang suasana politik kabar angin segar kaderkader pkb tunggu arah partai bambang susanto sang bendahara benar sk ditandatangani menteri hukum ham tonggak partai sk kemenkumham lengkap posisi ketua hari deputi sekretaris eksekutif bambang wartawan jakarta jabatanjabatan curi perhati tambah wakil ketua capai enam orang sembarang putus cermin strategi pkb hadap kompetisi politik ketat susun urus umum kalah tarik kh maruf amin ketua dewan syuro jajar wakil ketua tujuh orang posisi ketua pegang cak imin enam wakil ketua damping jalan roda organisasi jazilul fawaid ida fauziyah hanif dhakiri cucun ahmad syamsurijal faizol reza m rano alfath masingmasing percaya duduk posisi strategis ubah susun urus sk simbol sinambung baru tubuh pkb pegang jabat partai hadap kontestasi politik 2024 urus ramping organisir harap tingkat efektivitas kerja pkb panggung politik nasional susun urus pkb tetap ketua dewan syuro kh maruf amin ketua muhaimin iskandar wakil ketua jazilul fawaid ida fauziyah hanif dhakiri cucun ahmad syamsurijal faizol reza m rano alfath ketua bidang didik pesantren syaiful huda sekretaris jenderal hasanudin wahid wakil sekjen 4 orang bendahara bambang susanto wakil bendahara 5 orang narasi politik indonesia pkb partai basis massa kuat kalang nahdliyin kerap tentu pilih muhaimin iskandar malang lintang dunia politik indonesia sosok alam cak imin yakin bawa pkb posisi strategis legislatif eksekutif iring jalan harap pikul pundak urus pkb partai rakyat kontribusi nyata pimpin cak imin harap satu elemen kuat fondasi politik pkb hadap dinamika ikut berita baru times indonesia google news klik link lupa follow,0
timesindonesia jakarta pimpin presiden ri prabowo subianto indonesia potensi bangkit macan asia segani panggung internasional fokus mandiri pangan energi kuat ekonomi tega hukum prabowo harap bawa indonesia era kuat regional tangguh berpengaruhadvertisement analisis ketua poros pemuda indonesia ppi muhlis ali dapat kait prospek perintah prabowo rabu 492024 muhlis indonesia ambang transformasi lantik presiden republik indonesia 20 oktober 2024 prabowo subianto prediksi langsung tancap gas wujud janjijanji kampanye nanti rakyat indonesia 20 oktober prabowo media darling simbol harap rakyat nama harum popularitas alami lonjak perintah kerap initial popularity surge muhlis ali bangun demokrasi sehat muhlis nilai prabowo milik visi kuat pimpin bangsa bagai sempat prabowo demokrasi sehat kelola kuasa tanggung apresiasi ungkap prabowo sebut haus kuasa ganggu rugi bangsa prabowo acu pandang demokrasi modern kuasa tangan rakyat jalan integritas muhlis salah agenda perintah prabowo profesionalisme fungsi intelijen acara tutup kongres pan prabowo tekan intelijen penting bangsa alat politik pakai alatalat caracara duludulu adu domba ngintelngintelin orang intel tuh rakyat bangsa ngintelin lawan politik nggak enak prabowo muhlis ali sebut nyata angin segar demokrasi indonesia alat negara intimidasi lawan politik demokrasi ancam mantan ketua pb hmi tekan bebas ekspres bebas pers pilar demokrasi sehat era pimpin prabowo kriminalisasi oposisi pers beda dapat perintah suara kritis ruang bungkam beda pandang turut jaga bebas kunci bangun perintah buka transparan akuntabel dorong partisipasi aktif elemen masyarakat muhlis apresiasi upaya prabowo galang satu rekonsiliasi turut kuat ajak imbang fungsi oposisi demokrasi oposisi jaga check and balance oposisi objektif beda dasar mandiri pangan energi konteks ekonomi prabowo tempat swasembada pangan energi prioritas utama kurang gantung impor nyata prabowo sebut indonesia takut negara mana hasil daulat bidang pangan energi muhlis bukti komitmen prabowo kuat daulat ekonomi nasional salah langkah konkret ambil perintah selesai uji coba komersil solar bas sawit kadar 40 persen b40 langkah upaya nyata kurang gantung bahan bakar fosil kembang energi baru muhlis sorot berani prabowo hadap presiden prancis emmanuel macron usaha uni eropa kait embargo minyak sawit indonesia terima kasih larang kelapa sawit masuk eropa kelapa sawit penting rakyat swasembada energi prabowo muhlis sikap patut apresiasi teguh prabowo tahan daulat indonesia hadap kuat internasional transparansi supremasi hukum muhlis ali tekan transparansi akuntabilitas perintah rakyat yakin perintah prabowo benarbenar penting kelompok prabowo jaga integritas perintah bersih bebas korupsi muhlis supremasi hukum sorot utama muhlis tega hukum adil sulit perintah bangun citra bersih wibawa prabowo hukum tegak pandang bulu kunci jaga percaya rakyat muhlis ali menggarisbawahi komitmen prabowo berantas korupsi momok serius indonesia nyata prabowo sisih anggar khusus berantas korupsi kejar koruptor lari antartika genderang perang korupsi dukung indonesia macan asia muhlis ali percaya alam lengkap prabowo didik militer didik modern barat peran oposisi pimpin organisasi massa bekal kuat prabowo bawa indonesia macan asia segani dunia wujud visi muhlis kabinet solid orientasi tingkat tumbuh ekonomi cipta lapang kerja revitalisasi industri kembang sumber daya manusia unggul dukung usaha mikro tengah umkm kuat akses mudah biaya teknologi pasar kelola bijak fiskal efektif kurang pajak beri insentif sektor bijak moneter jaga stabilitas inflasi suku bunga rendah faktor tentu capai tumbuh ekonomi lanjut dinamika global prabowo demokrasi indonesia milik karakteristik khas demokrasi pancasila depan musyawarah mufakat waris nenek moyang prabowo demokrasi ala barat demokrasi indonesia ciri khas demokrasi pancasila muhlis nilai pandang relevan standar ganda terap negaranegara barat sepenuh cocok acu indonesia periode tentu indonesia muhlis ali poros pemuda indonesia awal dukung konstruktif perintah prabowo momen lompat maju ppi awal dukung konstruktif perintah prabowo muhlis ali ikut berita baru times indonesia google news klik link lupa follow,0
timesindonesia lombok timur bupati lombok timur periode sukiman azmy mantap dukung pasang muhammad iqbal indah dhamayanti putri iqbaldinda pilkada ntb 2024 dukung urung maju pilgub ikhtiar menang pasang iqbaldinda sukiman temu khusus iqbal ponpes buak ate kembang mate camat sakra lombok timur rabu 492024advertisement sempat sukiman utara kagum iqbal sungguh niat juang bangun ntb dasar rawan hadir temu percaya mantan dubes turki iqbal bangun ntb program susun rapi lupa mantan bupati lombok timur periode titip harap iqbal perhati khusus dunia didik pondok pesantren anak yatim piatu ilah perhati pondok pesantren anak yatim jamin harap sempat muhammad iqbal terimakasih dukung sukiman azmy sukiman azmy anggap sikap politik positif tonton politis senior sanjung sikap politik positif ayah sukiman red iqbal acara limut senyum bahagia iqbal cita alas pulang kampung henti dubes turki muncul sempat pulang kampung hajat citacita pendam bangun kampung halaman ntb hajat 28 berkarir kait bangun daerah iqbal nilai tata kelola salah provinsi ntb syarat butuh ntb daerah maju sdm sda butuh tata kelola terusterusan jebak 10 provinsi miskin indonesia moga niat diijabah allah ubah tata kelola ntb harap gabung tim sukiman azmy lapis tebal kuat terimakasih ayah sukiman tim iqbal sambut ikut berita baru times indonesia google news klik link lupa follow,0
timesindonesia mojokerto ribu kader pkb kabupaten mojokerto konsolidasi menang jelang helat pilih milu serentak gubernur wakil gubernur bupati wakil bupati 2024 ketua dpc pkb kabupaten mojokerto ayni zuroh konsolidasi langkah baris menang pasang calon bupati wakil bupati ikfina fahmawati sadullah syarofiadvertisement konsolidasi serentak bagi 18 camat serentak target menang kandidat usung idola akronim ikfina fahmawati sadullah syarofi red ayni masingmasing ranting pkb undang 90 130 orang kader harap kuat dukung aspirasi masyarakat pilih sosok pimpin daerah sejahtera masyarakat harap konsolidasi bawa menang pasang idola berkontestasi 27 november 2024 pungkas samping pkb kabupaten mojokerto konsolidasi menang pasang gubernur wakil gubernur luluk nur hamidah lukmanul hakim ikut berita baru times indonesia google news klik link lupa follow,0
timesindonesia lombok timur bupati lombok timur periode sukiman azmy mantap dukung pasang muhammad iqbal indah dhamayanti putri iqbaldinda pilkada ntb 2024 dukung urung maju pilgub ikhtiar menang pasang iqbaldinda sukiman temu khusus iqbal ponpes buak ate kembang mate camat sakra lombok timur rabu 492024advertisement sempat sukiman utara kagum iqbal sungguh niat juang bangun ntb dasar rawan hadir temu percaya mantan dubes turki iqbal bangun ntb program susun rapi lupa mantan bupati lombok timur periode titip harap iqbal perhati khusus dunia didik pondok pesantren anak yatim piatu ilah perhati pondok pesantren anak yatim jamin harap sempat muhammad iqbal terimakasih dukung sukiman azmy sukiman azmy anggap sikap politik positif tonton politis senior sanjung sikap politik positif ayah sukiman red iqbal acara limut senyum bahagia iqbal cita alas pulang kampung henti dubes turki muncul sempat pulang kampung hajat citacita pendam bangun kampung halaman ntb hajat 28 berkarir kait bangun daerah iqbal nilai tata kelola salah provinsi ntb syarat butuh ntb daerah maju sdm sda butuh tata kelola terusterusan jebak 10 provinsi miskin indonesia moga niat diijabah allah ubah tata kelola ntb harap gabung tim sukiman azmy lapis tebal kuat terimakasih ayah sukiman tim iqbal sambut ikut berita baru times indonesia google news klik link lupa follow,0
timesindonesia jakarta final miss universe indonesia 2024 karen nijsen jalan advokasi kenal nama langkah karya gera bagi senyum ilmu bahagia cinta anakanak tanah air founder satulangkahsatukarya advokasi giat jalan 2019 karen sapa akrab times indonesia pesan tulis selasa 03082024advertisement milik akun media sosial instagram tiktok karennijsen edukasi bahasa komunikasi bimbing perihal fokus anakanak cerdas yatimpiatu dhuafa kelompok milik motivasi bina ratus orang orang tua asuh kakak asuh sahabat setia anakanak tingkat didik anak usia paud tingkat smasmk karen milik hobi baca fashion estegrafi scuba diving golf badminton formula one soccer masak binatang anak kelompok kerap jangkau advokasi sambung karen gera 2019 bina siswi kelas 7 smp desa kabupaten lumajang provinsi jawa timur interaksi ratus anakanak kelompok beda wilayah latar gender perempuan milik alam modelling indonesia cina thailand japan uk hongkong alas terjun dunia manusia karen cerita 2019 wanita remaja tinggal desa jawa timur kirim message sosial media nama ferlita cerita hidup positif kisah hidup untung situ anak hak citacita sukses gera buat anakanak indonesia imbuh karen milik alam bisnis villakaniksabali fokaid ullubali final miss universe indonesia 2024 karen nijsen jalan advokasi langkah karya foto karen for times indonesia anak saudara harap sistem perintah kait perhati khusus anakanak indonesia milik hak kompetisi dunia internasional biasa budaya bahasa internasional hidup seharihari karen brand ambassador azzura combiphar madurasa air mancur poise bukalapak enes antis perempuan cantik lahir bandung model actress entrepreneur and activist jarang kuasa bahasa internasional milik anakanak daerah desa untung yatimpiatu harap advokasi langkah karya milik sekolah anakanak cerdas dhuafa yatim piatu masuk universitas kualitas negeri indonesia bangun bangsa negara tambah informasi alam karen bidang hosting 1 premiere league on vidio 2 persija tv 3 lensa olahraga antv 4 pov trans7 5 lapor 6 meet greet michael owen 7 health is wealth on sea today sport7 trans7 8 behind the sportscar transvision ikut berita baru times indonesia google news klik link lupa follow,1
timesindonesia malang azquira scarf gelar acara luncur merek kenal produkproduk baru hotel grand cakra kota malang minggu 182024 sempat azquira scarf kenal produk hijab kualitas inspirasi malang produkproduk liput the mantra emboss series icon signature toegoe malang bayang kenalin series red wine nama azquira ambil gabung nama anakanak milik brand azel quilla akiraadvertisement huruf nama azquira milik makna sendiri huruf a wakil autentik monogram hijab azquira logo tulis cermin feminisme bahas isuisu putar wanita desain azquira kandung nilai dakwah inspirasi arif lokal ilustrasi kayutangan heritage ijen street balai kota tugu azquira fokus pasar kota malang huruf q kandung makna kualitas bahan baku voal ultrafine milik unggul panas mudah kusut setrika huruf r wakil respect cermin peduli azquira halhal perempuan wanita erti kali insecure siti farida milik brand azquira scarf produk hijab luncur azquira scarf foto valentina kusmila putritimes indonesia tarik model acara model profesional karyawan latih modeling milik azquira lahir malang tema produk azquira angkat malang acara azquira undang youtuber selebgram malang mama lela hibur tamu undang riah acara luncur brand azquira produk azquira kenalin series bayang series the mantra susun trilogi beli harap koleksi produkproduk tahap kenalin series bayang series the mantra kenalin series tampil motif gambar azquira sombong filosofi bayang series kenal kenang terbayangbayang tuju bentuk brand milik perembuan perempuan insecure ubah siti farida target pasar azquira warga kota malang rentang usia kalang muda tua siti farida harap produkproduknya azquira scarf inspirasi wanita percaya bangga identitas ikut berita baru times indonesia google news klik link lupa follow,1
